{
  "$schema": "https://json-schema.org/draft/2020-12/schema",
  "$id": "https://joblens.local/schemas/job-page.schema.json",
  "title": "JobPage",
  "type": "object",
  "required": ["total", "limit", "offset", "items"],
  "properties": {
    "total": {"type": "integer", "minimum": 0},
    "limit": {"type": "integer", "minimum": 1, "maximum": 100},
    "offset": {"type": "integer", "minimum": 0},
    "items": {
      "type": "array",
      "items": {"$ref": "job.schema.json"}
    }
  },
  "additionalProperties": false
}
