{
  "total": 1,
  "limit": 20,
  "offset": 0,
  "items": [
    {
      "id": "job_example",
      "title": "AI 应用开发工程师",
      "company": "示例公司",
      "area": "武汉",
      "salaryMinK": 15,
      "salaryMaxK": 30,
      "remoteStatus": "unknown",
      "remoteConfidence": "low",
      "source": "boss",
      "sourceUrl": "https://www.zhipin.com/job_detail/example.html",
      "sourceVersion": "1.3.1",
      "collectedAt": "2026-07-21T00:00:00Z"
    }
  ]
}
